<?xml version="1.0" encoding="UTF-8"?>
<!--Sample XML file generated by XMLSpy v2005 rel. 3 U (http://www.altova.com)-->
<EFGDocument xmlns:xsi="http://www.w3.org/2001/XMLSchema-instance" xsi:noNamespaceSchemaLocation="EFGDocument.xsd">
	<datasources>
		<datasource submitterRef="1" name="IthData" efgKey="1"/>
	</datasources>
	<TaxonEntries>
		<TaxonEntry>
			<Items ordered="false" name="Migration">
				<Item resourceLink="http://alpaca.cs.umb.edu/efg/search?" efgKeyRef="1"  annotation="Migration is Common" caption="Migration pattern">Common</Item>
			</Items>
			<Items ordered="false" name="Scientific name">
				<Item resourceLink="http://alpaca.cs.umb.edu/efg/search?Scientific name=" efgKeyRef="1"  annotation="xx" caption="xxx">Pteronymia notilla</Item>
			</Items>
			<Items ordered="false" name="Identification">
				<Item resourceLink="http://alpaca.cs.umb.edu/efg/search?Scientific name=" efgKeyRef="1"  annotation="xx" caption="xxx">Antennae black, forewing costa all black, ventral forewing border with white spot line, markings blacker than fulvimargo.
</Item>
			</Items>
			<EFGLists name="Larval food plants" ordered="false" resourceLink="">
				<EFGList efgKeyRef="1" annotation="ccc" caption="ccc" resourceLink="Scientific Name">Solanum tuerckheimii</EFGList>
			</EFGLists>
			<MediaResources name="Image: female ventral" ordered="false">
				<MediaResource efgKeyRef="1" annotation="An image of the female ventral of  Ithomia notilla" caption="Female ventral" resourceLink="http://efg.cs.umb.edu/xxx.jpg" type="Image">Pte-not-fv-620-184.jpg#Pte-not-fv-620.jpg</MediaResource>
			</MediaResources>
			<MediaResources name="Image: female dorsal" ordered="false">
				<MediaResource efgKeyRef="1" annotation="An image of the female dorsal of  Ithomia notilla" caption="Image" resourceLink="http://efg.cs.umb.edu/xxx.jpg" type="Image">Pte-not-fd-620-184.jpg#Pte-not-fd-620.jpg</MediaResource>
			</MediaResources>
			<StatisticalMeasures name="Pacific slope">
				<StatisticalMeasure efgKeyRef="1" min="1200" max="1500" units="m"/>
			</StatisticalMeasures>
		</TaxonEntry>
	</TaxonEntries>
	<submitters>
		<submitter name="Bill Haber" submitterKey="1"/>
	</submitters>
</EFGDocument>
